{
  "$schema": "https://json-schema.org/draft/2020-12/schema",
  "$id": "https://raw.githubusercontent.com/zwcih/kindle-calendar-dashboard/main/config.schema.json",
  "title": "Kindle Calendar Dashboard configuration",
  "type": "object",
  "additionalProperties": false,
  "required": ["nextcloud", "weather"],
  "properties": {
    "nextcloud": {
      "type": "object",
      "additionalProperties": false,
      "required": ["caldav_url", "username", "password_env"],
      "properties": {
        "caldav_url": {"type": "string", "format": "uri", "pattern": "^https://"},
        "webdav_url": {"type": "string", "format": "uri", "pattern": "^https://"},
        "username": {"type": "string", "minLength": 1},
        "password_env": {"type": "string", "pattern": "^[A-Z_][A-Z0-9_]*$"}
      }
    },
    "weather": {
      "type": "object",
      "additionalProperties": false,
      "required": ["latitude", "longitude", "timezone"],
      "properties": {
        "latitude": {"type": "number", "minimum": -90, "maximum": 90},
        "longitude": {"type": "number", "minimum": -180, "maximum": 180},
        "timezone": {"type": "string", "minLength": 1}
      }
    },
    "display": {
      "type": "object",
      "additionalProperties": false,
      "properties": {
        "width": {"type": "integer", "minimum": 1},
        "height": {"type": "integer", "minimum": 1}
      }
    },
    "fonts": {
      "type": "object",
      "additionalProperties": false,
      "properties": {
        "regular": {"type": "string", "minLength": 1},
        "bold": {"type": "string", "minLength": 1}
      }
    }
  }
}
